<?xml version="1.0" encoding="UTF-8"?>
<itso:accounts xmlns:itso="http://itso.xml.com" xmlns:xsi="http://www.w3.org/2001/XMLSchema-instance" xsi:schemaLocation="http://itso.xml.com Accounts.xsd ">
  <itso:account>
    <itso:accountID>itso:accountID</itso:accountID>
    <itso:accountType>Savings</itso:accountType>
    <itso:balance>0.0</itso:balance>
    <itso:interest>0.0</itso:interest>
    <itso:customerInfo>
      <itso:firstName>itso:firstName</itso:firstName>
      <itso:lastName>itso:lastName</itso:lastName>
      <itso:phoneNumber>itso:phoneNumber</itso:phoneNumber>
    </itso:customerInfo>
  </itso:account>
</itso:accounts>
